text,complexity,domain,severity,tone,resolution_hint,requires_onsite
Having trouble connecting to wifi at home office. Keeps dropping connection every few minutes.,simple,networking,medium,frustrated,Restart router and check for nearby interference sources.,false
"I'm trying to set up a new laptop on our company wifi, but it says it can't get an IP address. Help!",simple,networking,low,calm,Verify DNS settings and ensure WiFi is enabled.,false
Our VPN connection to HQ keeps timing out every hour. It's really annoying. Can you fix it?,simple,networking,medium,urgent,Check VPN server status and adjust timeout settings.,false
I'm having trouble accessing a specific website from my work computer. Error says DNS lookup failed.,simple,networking,low,confused,Check DNS cache and try flushing it if necessary.,false
Why is my network connection so slow? I'm transferring files to our cloud storage and it's taking ages.,simple,networking,medium,frustrated,Check for packet loss and adjust MTU settings if necessary.,false
"Hi, I'm having trouble connecting to our company's VPN from my laptop at home. It keeps saying the password is incorrect even though I know it's correct. Can you help me with that?",simple,networking,medium,frustrated,Check your VPN password and try reconnecting.,false
I'm trying to set up a new device on our WiFi network but it won't recognize my credentials. I've tried resetting the password multiple times and nothing's working.,simple,networking,low,calm,Check your login credentials and ensure they match our WiFi network settings.,false
I'm experiencing some packet loss on my internet connection. It's really slow and sometimes I lose connectivity altogether. Can you look into it?,simple,networking,medium,urgent,Check for any routing issues or firewall settings that might be causing the packet loss.,false
I'm trying to connect my device to our company's VPN but it keeps saying I don't have permission. I've checked with our IT department and they said everything looks good on their end.,simple,networking,medium,confused,"Verify your VPN permissions and try connecting again, checking for any VLAN restrictions.",false
I'm having trouble accessing some websites because they're blocked by our company's firewall. Is there a way to unblock them?,simple,networking,low,frustrated,Check the website's IP address and ensure it's not blocked by our firewall settings.,false
"my laptop can't connect to office wifi at all anymore, it was working fine yesterday",simple,networking,medium,frustrated,restart the router and check for interference from nearby devices,false
"i'm having trouble accessing some websites because my firewall is blocking them, how do i allow specific sites?",simple,networking,low,calm,add the websites to the firewall's exception list or adjust the blocking rules,false
"my internet is super slow today, it took like 10 minutes to load a simple webpage what's going on?",simple,networking,low,confused,check for packet loss or high latency and adjust the network settings accordingly,false
"i'm having trouble connecting to our company's VPN, it keeps saying connection timed out",simple,networking,medium,frustrated,check the VPN server status and ensure your configuration is correct,false
i'm trying to set up a new vlan on our lan but it keeps giving me an error about duplicate subnet,simple,networking,medium,calm,verify the subnet range and ensure it doesn't conflict with existing VLANs,false
"Having trouble connecting to wifi at home office, keep getting disconnected",simple,networking,medium,frustrated,Check wireless channel and switch to a less crowded one,false
"Can't ping the server, packets are being dropped all over the place",simple,networking,medium,urgent,Check the firewall rules and allow the traffic,false
Why does my laptop keep losing connection to the VPN? It's really annoying,simple,networking,low,frustrated,Try restarting the VPN client and reconnect,false
"DNS is super slow, takes forever to resolve names, any ideas?",simple,networking,low,calm,Check the DNS server IP and adjust the resolver settings,false
I'm getting disconnected from my VLAN when I try to access the fileserver,simple,networking,medium,frustrated,Verify the VLAN settings and check for any configuration issues,false
hi I'm having trouble connecting to our company wifi at home I've tried restarting my router and modem but still nothing help,simple,networking,medium,frustrated,Check VPN settings on your router and ensure QoS is disabled.,false
I'm trying to access a shared drive on our office lan but I keep getting a timed out error what's going on?,simple,networking,low,calm,Verify VLAN membership and ensure connection is stable.,false
I'm trying to set up my work laptop on the company VPN but it's not working I've tried all the troubleshooting steps online help!,simple,networking,medium,urgent,Check packet loss and firewall rules; ensure correct VPN server selection.,false
I'm having trouble routing traffic between two subnets on our network I've tried configuring the route but it's not working help me out!,simple,networking,medium,frustrated,Verify routing tables and ensure subnet masks match.,false
I'm trying to connect my home router to our office network using a site-to-site VPN but it's not establishing the connection what am I doing wrong?,simple,networking,low,confused,Verify IP address ranges and ensure DNS resolution is correct.,false
I'm trying to connect to our VPN but it's not working. I've tried restarting my laptop and the issue persists.,simple,networking,medium,frustrated,Check VPN server status and try reconnecting.,false
I'm having trouble accessing a website. It says my DNS is not properly configured.,simple,networking,low,confused,"Try restarting your router and modem, then try accessing the site again.",false
I'm trying to set up a new WiFi network on my smart TV but it's not connecting. It keeps saying 'Authentication failed'.,simple,networking,low,calm,Check your WiFi password and ensure you're entering the correct credentials.,false
I'm having issues with packet loss on my LAN connection. It's causing some of my software to freeze up.,simple,networking,medium,frustrated,Check for firmware updates on your network card and ensure it's properly configured.,false
I'm trying to set up a VLAN on our company's LAN but I'm not sure where to start. Can you help me?,simple,networking,low,calm,Consult your company's network documentation and follow the setup guide.,false
I'm having trouble connecting to our VPN from my home office. It works fine on my work PC but not on my laptop. Getting an error message saying ' unable to establish secure connection'. Can you help me out?,moderate,networking,medium,frustrated,Verify VPN client version and ensure laptop's date/time are accurate.,false
Why am I experiencing packet loss on our company WiFi? It's really slow too. We've got around 5 users affected so far. Any idea what's going on?,moderate,networking,high,urgent,Check for VLAN configuration issues and potential wireless interference.,false
I'm having trouble accessing an internal website (example.com). DNS resolution is failing. Can you help me figure out why? It's just one user affected so far.,moderate,networking,medium,calm,Verify DNS server IP and check for any domain name conflicts.,false
What's going on with our router? It seems to be dropping packets randomly. We've got a few users reporting issues. Can you troubleshoot this?,moderate,networking,high,frustrated,Check for routing table inconsistencies and potential firewall rules conflicts.,false
We're experiencing issues with our WiFi roaming. Users are getting kicked off the network when they move to a different area. Anyone have any ideas?,moderate,networking,medium,confused,Verify AP configuration and wireless settings for roaming capabilities.,false
I'm trying to access our company's VPN from home but it's not working. I get an error message saying 'server not found'. Help!,moderate,networking,medium,frustrated,Check VPN server IP and DNS settings for any typos.,false
Our WiFi is super slow today. I've tried restarting my laptop but nothing's working. There are 5 other employees in the office having the same issue. Please help!,moderate,networking,medium,frustrated,Run a network scan to identify any conflicts or misconfigured devices.,false
I'm having trouble connecting to our company's VPN. It says 'connection timed out'. I've tried restarting my computer and router but it's still not working. Help!,moderate,networking,high,urgent,Check firewall rules for VPN traffic and ensure correct port forwarding.,false
Some of our devices on the LAN are having issues with packet loss. We're experiencing random disconnections and slow data transfer rates. Can you please look into this?,moderate,networking,medium,calm,Investigate network congestion and consider adjusting Quality of Service settings.,false
I'm trying to set up a new VLAN for our marketing team but I'm having trouble getting the DHCP server configured correctly. Can someone please help me out?,moderate,networking,medium,confused,Review DNS settings and ensure correct subnetting for the new VLAN.,false
I'm having trouble connecting to our company VPN from my laptop at home. It keeps saying 'invalid username/password' even though I know it's correct. Can someone help me with this?,moderate,networking,medium,frustrated,Verify VPN credentials and server status.,false
"We're experiencing some packet loss on our WiFi network. It's only affecting 3 users, but we can't afford to have anyone disconnected during this project deadline. Can you help me troubleshoot?",moderate,networking,high,urgent,Check for concurrent connections and wireless interference.,false
"I'm trying to set up a new VLAN on our router, but I keep getting an error message saying it's already in use. Can someone walk me through how to resolve this?",moderate,networking,medium,confused,Check existing VLAN configurations and overlapping ranges.,false
"Our DNS is really slow today. It's been like this for hours, and our website is down. Can you help me figure out what's going on?",moderate,networking,high,panicked,Check DNS server logs and configuration for any issues.,false
"I'm having trouble accessing some websites from our office LAN. It says the site is blocked by our firewall, but I know it's not supposed to be. Can someone help me get around this block?",moderate,networking,medium,calm,Check firewall rules and exceptions for any misconfigured settings.,false
Cannot access company intranet from home VPN connection keeps dropping,moderate,networking,high,frustrated,Check VPN server logs for packet loss issues,false
"WiFi not working in meeting room, getting ' authentication failed' error message",moderate,networking,medium,calm,Check VLAN settings for rogue APs or misconfigured ports,false
"Firewall blocking traffic to our server, causing production downtime",moderate,networking,high,urgent,Verify firewall rules and adjust for specific IP addresses,false
We have multiple users reporting DNS resolution issues with our internal names,moderate,networking,medium,confused,Check for DNS server caching issues or misconfigured zone files,false
Packet loss and latency issues with our WAN connection causing data corruption,moderate,networking,high,frustrated,Investigate network equipment or circuit-level issues for packet corruption,false
"I'm trying to access our company's VPN but it keeps dropping connections after 10 minutes. I've tried restarting my laptop and router, but the issue persists.",moderate,networking,medium,frustrated,Verify DNS settings and potential firewall conflicts.,false
"I'm having trouble reaching our corporate email server from home. It says the domain doesn't exist, but I know it's correct.",moderate,networking,high,panicked,Check DNS records and potential routing issues.,false
"Our company's WiFi is super slow today. I've tried restarting the router, but it didn't help.",moderate,networking,medium,calm,Check for nearby interference and optimize WiFi settings.,false
I'm experiencing packet loss on our company's WAN connection. It's causing our database to timeout frequently.,moderate,networking,high,urgent,Verify network architecture and optimize routing for maximum throughput.,false
"I'm having trouble accessing our company's internal server from my workstation. It says 'access denied'. I've tried restarting everything, but it doesn't work.",moderate,networking,medium,frustrated,Check VLAN assignments and access control lists.,false
Having issues with WiFi at our office. Some devices can't connect and others are dropping signal frequently. Please help!,moderate,networking,medium,frustrated,Check router logs for dropped connections and adjust WiFi settings,false
"My VPN connection keeps timing out on my laptop. I've tried restarting it but no luck. Also, our external IP is unreachable from inside the network.",moderate,networking,high,urgent,Verify VPN server status and check for any firewall restrictions on the external IP,false
We're experiencing packet loss on our WAN connection. It's affecting 3 users who are trying to access a cloud-based app. Any idea why this is happening?,moderate,networking,medium,calm,Check WAN link quality and verify any routing configuration changes,false
"I'm trying to set up a new VLAN for our marketing team, but I'm getting errors when adding the new subnet. It's saying it already exists. Any help would be appreciated.",moderate,networking,medium,confused,Verify existing VLAN configurations and check for overlapping subnets,false
"I'm having trouble accessing a file share on our LAN. It's saying the server is unreachable. I've tried restarting my device, but no luck.",moderate,networking,high,frustrated,Check DNS resolution for the file share server and verify network connectivity,false
"Having issues with VPN connecting on client laptops. Keeps saying 'no internet access'. Tried restarting it several times, but still not working.",complex,networking,high,frustrated,Check VPN server logs for recent disconnects and errors.,false
"Need help with DNS resolution on our production servers. Names look like they're not being resolved correctly. Multiple services affected, can't get accurate timestamps.",complex,networking,critical,urgent,Verify DNS server configuration and zone transfers with the upstream provider.,false
"WiFi on our main floor is dropping connections every 10 minutes. It's affecting all users, including customers. Can't seem to find any pattern or error logs that help.",complex,networking,high,frustrated,Check AP power levels and channel utilization. Consider switching to a different frequency.,false
"We're experiencing packet loss on our high-priority app server, causing data corruption and errors. Our network team tried troubleshooting VLAN configurations, but no luck.",complex,networking,critical,panicked,Verify VLAN trunk configurations and inspect packet captures for dropped packets.,false
"Our firewall rules are causing some unexpected blocking. We have multiple services being impacted, including our company's online portal. Need help reviewing the config to make it more permissive.",complex,networking,high,confused,Review firewall logs and rule sets to identify and relax unnecessary restrictions.,false
"We have multiple users reporting intermittent VPN connections dropping every hour. Users are saying they're seeing packet loss and latency issues. Our firewall logs show no unusual traffic or blocked requests. We've tried restarting the VPN server, but it doesn't seem to be helping.",complex,networking,critical,frustrated,Investigate DNS resolution issues and check for packet fragmentation.,false
"We're experiencing connectivity issues on our main LAN. Users are reporting slow speeds, dropped connections, and errors receiving packets. Our network team thinks it might be related to a recent VLAN configuration change. Can someone help us troubleshoot the issue? We have around 50 users affected.",complex,networking,high,calm,Verify VLAN settings and check for routing anomalies.,false
"We're having a crisis here! Our main WiFi network is down, and all our production users are affected. We can't even access the Internet. We tried restarting the APs and switching to the backup router, but nothing's working. Can someone please help us get this resolved ASAP?!",complex,networking,critical,panicked,Check for issues with the primary DNS server and verify WiFi configuration.,false
"Our users are experiencing difficulty connecting to our extranet VPN. They're getting 'connection timed out' errors, even after restarting their clients. We've checked the firewall rules and VPN configuration, but can't find any issues. Any ideas on what might be causing this? We have around 20 users affected.",complex,networking,high,confused,Check for DNS resolution issues and verify VPN client configuration.,false
"We're having trouble troubleshooting a strange routing issue. Users are reporting that some internal IP addresses are being routed to the wrong subnets. We've tried updating our router configurations, but it's not making any difference. Can someone help us figure out what's going on and how to fix it? We have about 15 users affected.",complex,networking,critical,frustrated,Investigate routing table inconsistencies and verify IP address mapping.,false
I'm trying to VPN into our office network but it keeps dropping after 2 minutes. We have over 100 users relying on this for remote work. Can you please help? It's impacting productivity significantly.,complex,networking,critical,frustrated,Verify VPN server connection and potential firewall restrictions.,false
"Our company WiFi is down across multiple locations. It's been 30 minutes since it went out and our sales team is struggling to stay connected. I'm the IT manager on site, but I'm stumped. Please assist ASAP.",complex,networking,high,urgent,Check WiFi controller and potential rogue AP issues.,false
"We're experiencing packet loss on our VoIP calls, affecting 20+ users. Our phones are down and customers are getting frustrated. I've tried restarting the PBX but it didn't help. Can someone senior come take a look?",complex,networking,high,frustrated, Investigate router configuration and potential QoS issues.,false
"Our internal DNS is resolving incorrectly, causing all sorts of issues with our database queries. We have 10+ users affected and it's affecting productivity badly. I've tried flushing the cache but nothing changed. Please help ASAP.",complex,networking,critical,urgent,Verify DNS server configuration and potential zone issues.,false
"Our main office router is dropping packets, causing latency on our video conferencing systems. We have 50+ users affected and it's a major business continuity issue. I've tried resetting the router but nothing changed. Can someone please come and help?",complex,networking,high,frustrated,Check router configuration and potential firmware issues.,false
I'm getting errors setting up my VPN connection at home. It worked yesterday but now I get 'no route to host' every time. Please help.,complex,networking,high,frustrated,Verify DNS resolution and firewall settings.,false
We're experiencing packet loss on our LAN connection at the office. It's affecting multiple users and causing productivity issues. We've tried restarting the router but the issue persists.,complex,networking,critical,urgent,Check VLAN configuration and ensure correct trunking settings.,false
My WiFi is super slow today. I've tried restarting the router and modem but nothing's working. I have 10 employees waiting for me to get this fixed.,complex,networking,high,panicked,Investigate DNS resolution issues and verify WiFi settings.,false
"We're experiencing routing issues on our WAN connection. The issue seems to be intermittent, but it's affecting a few critical servers. We've tried restarting the router but it didn't fix the problem.",complex,networking,critical,calm,Check WAN configuration and ensure correct routing tables.,false
I'm having trouble connecting to our office's WiFi. It keeps asking me for authentication credentials even though I've tried logging in multiple times. This is affecting 15 users trying to access the network.,complex,networking,high,frustrated,Verify WiFi SSID and authentication settings.,false
Having issues with VPN connection on remote site. Users complaining of slow speeds and dropped calls. Investigated DNS settings but still not working. Production impact is huge.,complex,networking,critical,frustrated,Check VPN server logs for errors and reconfigure DNS settings accordingly.,false
"Firewall rules not allowing traffic between VLAN 10 and 20. Trying to access shared storage but getting permission denied. Tried updating firewall config, still no go.",complex,networking,high,calm,Verify firewall rule syntax and ensure correct VLAN IDs are used.,false
Routed VPN connection between HQ and remote site not working. Users reporting packet loss and disconnections. Tried reconfiguring router settings but still no success.,complex,networking,critical,urgent,Check routing tables for any discrepancies and verify VPN tunnel is established properly.,false
WiFi network down on floor 3. Users can't access internet or company resources. Investigated but no issues found with router or APs. Still doesn't work after rebooting.,complex,networking,high,panicked,Check network switches for any configuration errors or faulty ports causing the issue.,false
LAN traffic not being routed correctly. Certain subnets not accessible from other offices. Tried reconfiguring routing tables but still no success. Users reporting issues with file sharing.,complex,networking,critical,frustrated,Verify router configurations and check for any duplicate subnet IDs causing the issue.,false
I'm having trouble connecting my USB drive to my laptop. I've tried different ports and it doesn't seem to work.,simple,hardware,low,frustrated,Try using a different USB port or restarting your computer.,true
"My keyboard is not responding properly, it keeps typing extra characters and I'm getting really annoyed!",simple,hardware,medium,frustrated,Try restarting your computer or switching to a different keyboard.,true
I just got my new monitor and I'm having trouble setting up the dual monitor display on my desktop.,simple,hardware,low,calm,Check your display settings or consult the monitor's manual for guidance.,true
I tried to print a document but my printer is not responding. It just says 'offline' no matter what I do!,simple,hardware,medium,urgent,Try restarting your printer or checking the paper jam.,true
I'm having trouble getting my desktop to recognize my new keyboard. It's just not registering keystrokes.,simple,hardware,low,confused,Try restarting your computer or switching USB ports for the keyboard.,true
My laptop won't turn on this morning. I left it plugged in and charging overnight like always. Could you please help me figure out what's wrong?,simple,hardware,low,frustrated,Check the power cord and battery level.,true
I'm trying to print a report but my printer won't recognize the USB drive. It was working fine yesterday. Any ideas?,simple,hardware,medium,calm,Try unplugging and replugging the USB drive.,true
Help! My monitor won't turn on. I was using it just fine this morning but now it's dead. Is it a power supply issue?,simple,hardware,low,panicked,Check the power cord and try a different outlet.,true
I just got a new keyboard and it's not recognizing some of my keys. Any ideas what's going on?,simple,hardware,low,confused,Try resetting the keyboard settings.,true
"My desktop is really slow and freezing a lot. I just got some new software installed, could that be the cause?",simple,hardware,medium,frustrated,Try closing unnecessary programs to free up resources.,true
My laptop won't turn on. I was in the middle of writing an essay and now it's dead.,simple,hardware,low,frustrated,Check power cord and try booting in safe mode.,True
Printer not printing. It says it's out of paper but I know it's not. Stuck on one page!,simple,hardware,medium,urgent,Check printer queue and clear any stuck documents.,True
Mouse stopped working. Just stopped moving when I was playing games with my son.,simple,hardware,low,calm,Try swapping USB ports or restarting computer.,True
Keyboard keys are stuck. I spilled water on it and now the 'F' key won't work.,simple,hardware,low,frustrated,Clean keyboard with compressed air and check for any debris.,True
"Monitor not turning on. It's been working fine, just suddenly went dark.",simple,hardware,low,confused,Try plugging monitor into a different outlet or switching cables with another device.,True
"my laptop keyboard isn't working properly, keys are stuck",simple,hardware,medium,frustrated,clean the keyboard with compressed air and a soft cloth,true
help my printer is jammed again! i've tried restarting it but nothing works,simple,hardware,low,frustrated,try removing the paper tray and re-feeding the paper from the correct side,true
"my monitor won't turn on even when i've plugged it in, any ideas?",simple,hardware,medium,calm,try swapping the power cord or resetting the monitor settings,true
"my external hard drive isn't recognized by my computer, what's going on?",simple,hardware,low,confused,try re-plugging the USB cable or using a different port,true
"i'm having trouble getting my laptop to recognize my wireless mouse, please help!",simple,hardware,medium,urgent,try restarting the mouse or reinstalling the receiver software,true
my keyboard isn't working right. keys are sticking and not registering sometimes. what's going on?,simple,hardware,medium,frustrated,clean the keyboard with compressed air,true
