text,complexity,domain,severity,tone,resolution_hint,requires_onsite
I'm having trouble connecting to our MongoDB instance. It just hangs and won't authenticate. Help!,simple,database,medium,urgent,Check your credentials and ensure the connection string is correct.,false
I'm getting a 'Connection Pool Exhausted' error when trying to execute a query. Any ideas?,simple,database,low,confused,Increase the pool size or adjust your query logic.,false
My SQL query takes over 5 minutes to complete. Can you suggest a way to speed it up?,simple,database,medium,frustrated,Try adding indexes or rewriting the query using subqueries.,false
"PGAdmin showing 'timeout' error when trying to run query, how do I fix this? It's really slow too",simple,database,medium,frustrated,Check connection pool settings for idle timeout adjustment,false
"I'm getting duplicate data in my MySQL query results, why is this happening?",simple,database,low,calm,Verify query joins and check for missing indexes,false
"MongoDB node going down every hour, anyone know why this is happening?",simple,database,medium,urgent,Check MongoDB logs for error messages and restart node,false
"I'm trying to run SQL query in PostgreSQL, but it's timing out after 30 seconds. Help!",simple,database,medium,frustrated,Increase query timeout value or optimize query performance,false
"MySQL connection pooling not working, getting 'no suitable hosts found' error. What's going on?",simple,database,low,confused,Verify connection string and check for network issues,false
"PostgreSQL connection pool not working properly, getting timeout errors after 30 seconds. Can't query data",simple,database,medium,frustrated,Check the max idle time and min connection settings,false
I'm trying to connect to my MongoDB instance but it says 'connection to cluster timed out' after a minute. Help!,simple,database,low,urgent,Check the connection string and server status,false
SQL query not working as expected. Getting an error saying 'too many connections'. Can you help me fix this?,simple,database,medium,calm,Increase the max_connections value in your MySQL config file,false
I'm getting a connection timeout error when trying to query my PostgreSQL database using phpPgAdmin. Any ideas?,simple,database,medium,frustrated,Check the network latency and DNS resolution,false
"My SQL query takes forever to execute, can you help me optimize it? It's a simple select statement with filters.",simple,database,low,confused,Check the index on the filtered column and consider using an EXISTS clause,false
"Hey, I'm trying to query a PostgreSQL database but it's freezing every time I try to connect with the connection pool. Tried restarting the service and checking logs for errors.",moderate,database,high,frustrated,Check connection pool settings and query timeout,false
"I'm trying to optimize queries in a MySQL database for our web app, but I'm getting timeouts on large datasets. Can you help me tweak the query?",moderate,database,medium,calm,Review query optimization options and indexes,false
"Mongod just crashed on our MongoDB instance, leaving us with no data access. Last logs showed high CPU usage before the crash.",moderate,database,high,panicked,Restart Mongod and check system resources,false
"I'm trying to troubleshoot a slow query in our PostgreSQL database. The query runs fine on development, but takes ages on production. Any ideas?",moderate,database,medium,confused,Check for differences between dev and prod environments,false
"Our MySQL instance is not responding. Last thing I did was run an update statement, but it's been stuck for hours.",moderate,database,high,urgent,Check query logs and cancel the running statement,false
I'm getting a timeout error when trying to query our MongoDB database using Robomongo. I've checked the connection settings and they seem fine. Any ideas?,moderate,database,medium,frustrated,Check MongoDB server logs for errors,false
Our PostgreSQL database is slow. We've had ~5 users complaining about long query times. I checked the query plans and they look normal. Any ideas?,moderate,database,medium,calm,Analyze query performance metrics,false
"I'm trying to connect to our MySQL database from Python using the mysql-connector library, but it keeps timing out after 10 seconds. I've checked the connection settings and they're correct.",moderate,database,medium,frustrated,Check network connectivity to database server,false
"Our MongoDB cluster is down. We had ~3 users affected, but it's resolved now. I restarted the node process and it came back up.",moderate,database,high,urgent,Restart node processes on the cluster,false
"I'm getting a 'too many connections' error when trying to query our PostgreSQL database. I've checked the connection pool settings, but they seem fine. Can you help?",moderate,database,medium,confused,Adjust connection pool max size,false
I'm trying to run a query on our MySQL DB but it's taking forever (like 30 mins). I've checked the connection pool and everything looks good. Any ideas?,moderate,database,high,frustrated,Check query execution plan for possible optimizations.,false
We're experiencing some issues with our MongoDB instance. Sometimes it takes a long time to connect or sometimes we get timeouts. Any suggestions?,moderate,database,medium,calm,Verify connection string and network configuration.,false
I'm trying to migrate a PostgreSQL DB from v9.5 to 12.4 but I keep getting errors during the upgrade process. Any help?,moderate,database,high,urgent,Check compatibility of third-party extensions before upgrading.,false
We're getting some weird errors with our SQL queries. It seems like they're timing out sometimes and we lose data. Any ideas on what's going on?,moderate,database,high,frustrated,Check query timeout settings and adjust if necessary.,false
I'm trying to troubleshoot an issue with our MySQL DB. Sometimes we get a 'too many connections' error even though I've increased the limit. Any ideas?,moderate,database,medium,confused,Verify application connection pooling and adjust limits accordingly.,false
"Hello, I'm trying to run a query on my PostgreSQL database but it's timing out after 10 seconds. I've tried increasing the connection pool size but nothing seems to work.",moderate,database,high,frustrated,Check PostgreSQL configuration for query timeout settings and consider adjusting wait_timeout parameter.,false
I'm experiencing strange errors when trying to connect to my MySQL database from Python. The error says ' lost connection to MySQL server during query' even though the script runs fine on my local machine.,moderate,database,medium,calm,Check network connectivity and verify that host is not blocked by any firewalls or IDS/IPS.,false
Our MongoDB instance is having trouble connecting to the replica set. It just keeps saying 'cannot connect to server: [source]: [timeout]'. This is causing our application to crash!,moderate,database,high,urgent,Check replica set configuration and ensure all nodes are reachable; consider verifying network connectivity between nodes.,false
"I'm trying to run a SQL query on our MySQL database but it's taking forever. I increased the connection pool size, but nothing seems to work. Sometimes it works and sometimes not.",moderate,database,medium,confused,Investigate query execution time and consider optimizing queries or adjusting connection timeouts.,false
"We're experiencing some weird behavior with our PostgreSQL database. Sometimes it takes a few seconds to return results, but other times it just hangs for minutes. I've tried increasing the query timeout but nothing seems to work.",moderate,database,medium,frustrated,Check PostgreSQL configuration for query timeout settings and consider adjusting wait_timeout parameter.,false
I'm trying to run a query on our MySQL database but it's timing out after 30 seconds. I've tried increasing the timeout settings but nothing is working.,moderate,database,medium,frustrated,Check connection pool settings and query parameters,false
Our MongoDB instance keeps disconnecting from the cluster. I've checked the logs and it says something about 'network timeouts' but I don't know how to fix it.,moderate,database,high,panicked,Investigate network settings and MongoDB configuration,false
I'm trying to connect to our PostgreSQL database from a Python script but I keep getting an error saying the connection is refused. Has anyone else seen this?,moderate,database,medium,calm,Check PostgreSQL listener settings and firewall rules,false
"Our SQL queries are taking forever to execute. I've checked the query plans and they seem fine, but performance is terrible.",moderate,database,medium,confused,Analyze query plan and consider indexing or partitioning data,false
"I'm trying to get a report from our database, but it's taking ages to load. I've tried optimizing the query but it doesn't seem to be making a difference.",moderate,database,medium,urgent,Investigate data size and indexing strategies for improved performance,false
Postgres connection pool is timing out every minute and we're experiencing errors in our reporting dashboard which affects production. Multiple queries are failing due to this issue.,complex,database,critical,frustrated,Review connection pool settings for timeouts and adjust as needed.,false
We're experiencing issues with MongoDB queries slowing down significantly. It started after we rolled out a new feature last week. Users are complaining about slow performance.,complex,database,high,frustrated,Analyze query plans and consider re indexing the affected collection to improve performance.,false
We're having trouble connecting to our MySQL database. We keep getting an error saying the server doesn't support transactions. This is affecting multiple applications.,complex,database,critical,urgent,Check MySQL version and upgrade if necessary to resolve transaction issue.,false
Postgres query is taking over 10 minutes to complete. This is causing our reports to be delayed. We have a large dataset and are not sure what's causing the slow down.,complex,database,high,confused,Analyze query plan and consider adjusting statistics or rewriting the query to improve performance.,false
We're experiencing a high number of timeouts in our MySQL connection pool. This is causing issues with our application which affects 15+ users. We've tried increasing the timeout but it's still occurring.,complex,database,critical,frustrated,Verify database configuration and consider adjusting query concurrency to reduce timeouts.,false
PGAdmin is freezing on me every time I try to run a query. It's been like this all morning and I'm losing patience. Please help.,complex,database,high,frustrated,Check server logs for concurrency issues.,false
"We have a critical issue with our MySQL cluster. One of the nodes is throwing timeouts left and right, causing our app to crash. Can someone please look into this ASAP?",complex,database,critical,urgent,Verify connection pool settings and adjust if necessary.,false
"I'm trying to query a MongoDB collection but it's taking ages to return results. Is this normal? We're using a replica set, if that matters.",complex,database,high,confused,Check replica set lag and adjust if necessary.,false
Our PostgreSQL database is experiencing query timeouts left and right. We've tried increasing the connection timeout but it's still happening. Please help!,complex,database,high,frustrated,Verify query parameters and adjust if necessary.,false
"We have a multi-database issue. Our app is crashing every time we try to query any of our databases (PostgreSQL, MySQL, MongoDB). Please help us figure out what's going on!",complex,database,critical,panicked,Check database logs and network connectivity.,false
"we're experiencing database timeouts on our production MySQL server, impacting 12 users. query pool is maxed out since yesterday and queries are getting stuck in loop. please help ASAP.",complex,database,critical,urgent,Check query pool settings and optimize queries to reduce load.,false
"I'm trying to connect to our MongoDB instance from a Python script but it keeps timing out. I've checked the connection string, firewalls, and everything looks good. Any ideas?",complex,database,high,frustrated,Check MongoDB logs for errors and verify connection settings.,false
we've got a PostgreSQL database on RDS that's been slow as molasses since this morning. 10 users are reporting issues. I've tried restarting the instance but nothing changed.,complex,database,high,calm,Check for storage issues and optimize query performance.,false
"our SQL queries are taking forever to run, and the query logs show a bunch of 'aborted' entries. it's affecting 15 users. I've checked disk space and memory usage but nothing seems out of the ordinary.",complex,database,critical,panicked,Investigate query logs for errors and optimize query performance.,false
"I'm trying to troubleshoot a weird issue where our MySQL instance is refusing connections from certain IP addresses. I've checked the firewall rules, but nothing seems to be blocking it.",complex,database,high,confused,Verify MySQL settings and check for any security issues or configuration conflicts.,false
pg database issues all day. queries timing out frequently on production db. 10+ users affected. tried restarting server but issue persists.,complex,database,critical,frustrated,Check connection pool settings and query optimization,false
mongodb instance down. unable to connect. getting error 'connection refused' on multiple servers. urgent help needed!,complex,database,high,urgent,Verify MongoDB replica set and check for any disk space issues,false
"sql query taking forever. tried reindexing, optimizing tables, but no luck. 5+ users complaining about slow performance.",complex,database,high,frustrated,Check for any locks or blocking queries and optimize query plan,false
"multiple databases (postgres, mysql) not responding. timeouts on all connections. production systems down. need help ASAP!",complex,database,critical,panicked,Check system logs and network configurations for any errors or issues,false
"database queries failing randomly. getting errors like 'unknown database' on certain queries. tried restarting server, no luck.",complex,database,high,confused,Check database configuration files and user permissions for any inconsistencies,false
I'm trying to access my S3 bucket but it says I need to update my IAM password. Can you help me with that?,simple,cloud,low,calm,Change IAM password and try accessing the bucket again.,false
I've been trying to deploy my Kubernetes cluster all day but I keep getting an error about a missing pod. Can someone please help me?,simple,cloud,medium,frustrated,Check your YAML file for any typos or incorrect references.,false
I'm getting a billing alert on my Azure account saying I went over my limit. Can you tell me why?,simple,cloud,low,curious,Check your usage data for any unexpected spikes.,false
I'm having trouble connecting to my EC2 instance. It says it's not reachable from the public IP. Can someone fix this?,simple,cloud,low,calm,Check your security group rules and network ACLs.,false
I accidentally deleted my GCP project. Can you help me recover it?,simple,cloud,medium,panicked,Contact Google Support for assistance with restoring your project.,false
Help! I'm trying to upload my project files to S3 but it says permissions denied. Can someone help me figure out why?,simple,cloud,medium,frustrated,Check your IAM role permissions,false
I'm new to AWS and set up an EC2 instance but now it's stuck in a pending state. Any ideas what's wrong?,simple,cloud,low,calm,Check your security group settings,false
Azure billing alert keeps popping up saying I've exceeded my quota. How do I clear this?,simple,cloud,medium,urgent,Check your resource usage and adjust accordingly,false
Kubernetes deployment not showing up in cluster. Anyone have a clue why this is happening?,simple,cloud,medium,confused,Check your YAML file for syntax errors,false
Can't access my GCP bucket as it says 'access denied'. Help!,simple,cloud,low,frustrated,Check your credentials and permissions,false
My AWS S3 bucket won't let me upload files! I get an error message saying 'access denied'. Can you please help?,simple,cloud,medium,frustrated,Check IAM permissions for the bucket's owner.,false
"Azure Kubernetes Service is crashing my container! I've tried restarting it, but it keeps failing. Can you assist?",simple,cloud,medium,urgent,Check logs for container crash issues and update the container image.,false
"Why is my EC2 instance in GCP not starting? I've tried restarting it, but nothing's working. Can you please help?",simple,cloud,low,calm,Check the instance's status and ensure it's not stuck in a pending state.,false
"I'm getting weird billing alerts from AWS. It says I've gone over my quota, but I know I haven't used that much data. What's going on?",simple,cloud,medium,confused,Verify usage metrics and adjust the account's budget or usage limits.,false
"Azure Storage is not syncing my files properly. I've tried restarting the service, but nothing's working. Help!",simple,cloud,low,frustrated,Check Azure Storage account settings and ensure data is correctly synced.,false
I'm trying to deploy a new Kubernetes cluster in Azure but it keeps failing with an error message saying 'RBAC role not found'. Can someone please help me?,simple,cloud,medium,frustrated,Check the role binding and ensure the correct namespace is used.,false
I'm getting a billing alert saying I've gone over my daily budget in AWS. Can you help me figure out what's causing it? It looks like some unnecessary EC2 instances are running,simple,cloud,low,calm,Review and terminate the unused EC2 instances to avoid further charges.,false
"I'm having trouble accessing my GCP bucket. I can't list the files, keep getting a 'Permision denied' error. Can someone please help me?",simple,cloud,medium,confused,Verify your IAM permissions and ensure you have the correct role assigned.,false
"I'm trying to launch an EC2 instance in AWS but it's stuck in 'pending' state. I've tried restarting the instance, but nothing works.",simple,cloud,low,frustrated,Check the instance type and availability zone to ensure there are no resource issues.,false
I'm trying to set up a new S3 bucket in AWS but it's saying 'bucket already exists'. I swear I didn't create one yesterday... Can you help me figure out what's going on?,simple,cloud,medium,panicked,Verify the bucket name and ensure it's not a reserved name.,false
Help! I just got an email from AWS saying my S3 bucket's monthly bill is going to be way over budget.,simple,cloud,medium,frustrated,Check the usage report and update the storage class,false
Azure Kubernetes cluster not scaling. Keeps getting stuck at 'Creating' state.,simple,cloud,medium,calm,Check the node count and adjust resource allocation,false
Why am I getting a 'Forbidden' error trying to access my GCP bucket? IAM roles all set up.,simple,cloud,low,confused,Double-check the service account permissions,false
Can't connect to my EC2 instance. Just got an alert saying it's been down for hours.,simple,cloud,low,urgent,Check the security group rules and instance status,false
Sudden spike in my AWS EC2 cost. What's going on?! I didn't provision any new instances.,simple,cloud,medium,frustrated,Verify usage report and check for unexpected instance creation,false
I'm trying to upload a file to my S3 bucket but it's not working. It keeps saying 'upload failed'.,simple,cloud,medium,frustrated,Check your bucket name for typos or incorrect permissions,false
I'm having trouble accessing my Azure DevOps project. I get a 403 error when trying to view the code.,simple,cloud,low,calm,Verify your IAM role and permissions for the project,false
Why am I getting a billing alert for $500 on my GCP account? I only used 100MB of storage. Help!,simple,cloud,medium,urgent,Check your usage reports and quotas for unexpected charges,false
I'm trying to launch an EC2 instance but it's stuck on 'pending' state. What's going on?,simple,cloud,low,confused,Check your subnet and security group configurations for issues,false
My Kubernetes cluster is not updating my pod. I've restarted the container but it's still stuck.,simple,cloud,medium,frustrated,Check your deployment YAML file for errors or configuration issues,false
I'm trying to deploy my Kubernetes app on Azure but it keeps crashing due to some IAM permissions issue. Can someone help me troubleshoot? It's really frustrating.,moderate,cloud,high,frustrated,Check IAM role configuration and ensure correct permissions are assigned,false
"Hi, I'm getting billing alerts for an unexpected spike in EC2 usage. I don't recognize the instances or have any new deployments. Can you investigate what's going on?",moderate,cloud,medium,calm,Verify EC2 instance list and identify unusual instances for potential security risks,false
"My S3 bucket is not syncing data to Google Cloud Storage as expected. I've checked all the configs, but nothing's working. Please help!",moderate,cloud,medium,confused,Verify VPC and subnet configurations for correct network connectivity,false
"I'm trying to scale my Azure Functions app but it's not working. I've checked the documentation, but nothing is helping. Can someone please assist?",moderate,cloud,high,urgent,Review function configuration and adjust scaling parameters according to usage patterns,false
"I'm trying to migrate my EC2 instance from AWS to Azure, but I'm running into issues with network connectivity. Can you help me troubleshoot the problem?",moderate,cloud,medium,calm,Verify VPC and subnet configurations for correct network connectivity during migration,false
Having trouble with AWS S3 bucket permissions - users can't access files. We've had this issue before but the workaround stopped working yesterday.,moderate,cloud,high,frustrated,Re-run IAM role sync and verify bucket permissions,false
Azure Kubernetes cluster is slow - pods are timing out. We've added more nodes but performance hasn't improved.,moderate,cloud,medium,calm,Check node resource utilization and consider upgrading to a higher instance type,false
Got an email from AWS about high billing alert - suddenly our EC2 instances are using a lot more CPU. What gives?,moderate,cloud,high,urgent,Review recent instance modifications and optimize usage to reduce costs,false
Our Google Cloud Storage bucket is not accessible - getting a ' permissions denied' error. This happened before but we can't recall how we fixed it.,moderate,cloud,medium,confused,Verify IAM credentials and check for any recently modified ACLs on the bucket,false
AWS Lambda function is timing out - we've increased the timeout but it still doesn't work. We're starting to lose data.,moderate,cloud,high,panicked,Check function execution environment and consider increasing the allocated memory,false
"Hi, I'm getting an error when trying to upload a large file to S3. It keeps saying 'request timed out'. Help!",moderate,cloud,medium,frustrated,Check S3 bucket timeout settings and adjust if necessary.,false
"Azure Kubernetes cluster not scaling up correctly. I've checked the pods, but nothing's changing. Any ideas?",moderate,cloud,medium,confused,Verify autoscaling settings and ensure CPU utilization is above threshold.,false
"I've set up a GCP Cloud Function, but I'm getting authentication errors when calling it from my node.js app. What's going on?",moderate,cloud,medium,calm,Check function credentials and service account permissions.,false
"AWS EC2 instance is slow to start up, taking over 10 minutes. I've checked the logs, but nothing's out of the ordinary. Help!",moderate,cloud,medium,frustrated,Check instance type and consider upgrading to a more performant option.,false
We've received a billing alert saying our Azure subscription is over budget. Can you help me figure out what's going on?,moderate,cloud,high,urgent,Review usage and identify oversized instances or unexpected costs.,false
Help! I'm trying to deploy my Kubernetes cluster on GCP but it keeps failing due to IAM permissions issues. Can you please assist?,moderate,cloud,high,urgent,Check IAM roles and service accounts for the project.,false
I'm getting weird billing alerts on my AWS S3 bucket. It's saying I've used way more storage than expected. Can you help me figure out what's going on?,moderate,cloud,medium,confused,Check S3 bucket usage and look for unexpected uploads.,false
I'm trying to scale up my EC2 instance but it won't let me. I keep getting an error saying 'resource not found'. Any ideas?,moderate,cloud,medium,frustrated,Check the resource ID and ensure it exists.,false
My Azure Kubernetes cluster is not picking up the changes I made to the configuration file. Can you help me troubleshoot?,moderate,cloud,medium,calm,Check kubectl config and ensure it's updated.,false
I'm getting an error message saying 'access denied' when I try to access my GCP Cloud Storage bucket. Can you help me resolve this?,moderate,cloud,medium,panicked,Check IAM roles and permissions for the bucket.,false
"Hi team, I'm trying to access my S3 bucket but it's saying unauthorized despite having the correct IAM permissions. Can someone help me troubleshoot this?",moderate,cloud,medium,frustrated,Verify IAM role and check for any recent permission changes,false
We're experiencing issues with our Azure Kubernetes Service deployment. Nodes are randomly restarting and causing service downtime. Any ideas on what's going on?,moderate,cloud,high,urgent,"Check for any recent pod or node updates, and review Azure AKS logs for errors",false
