text,complexity,domain,severity,tone,resolution_hint,requires_onsite
Multiple users reporting lost connectivity to file shares on the LAN. Packet loss and latency issues observed.,complex,networking,critical,urgent,Verify firewall rules and routing tables for inconsistencies,false
WiFi connectivity issues in the lobby area. Guests complaining of disconnections and slow speeds.,complex,networking,high,calm,Check AP configuration and channel utilization,false
WiFi not working on the entire floor. Error message says 'no internet access'. We're losing productivity big time. Can you please fix ASAP?,complex,networking,critical,frustrated,Verify router configuration and WAN connectivity,false
Having issues with DNS resolution on our production server. It's affecting multiple services and causing errors. Can you help diagnose the issue?,complex,networking,high,calm,Review DNS zone files and check for any typos or inconsistencies,false
VPNs not working for the entire sales team! We're missing critical calls and emails because our systems are down. What's going on?! Can you please get this fixed ASAP?!,complex,networking,critical,urgent,Verify VPN server configuration and check for any firewall rules blocking traffic,false
"Cannot access remote office due to DNS issues, please assist ASAP. Multiple users affected.",complex,networking,high,urgent,Check DNS records and resolve any inconsistencies,false
"Frustrated here! Our company VPN connection keeps dropping, can't figure out why. Help appreciated.",complex,networking,critical,frustrated,Check firewall rules and ensure secure connections are enabled,false
"We're experiencing intermittent packet loss on our WAN link, affecting multiple users. Need assistance to resolve.",complex,networking,high,calm,Verify routing and switch configurations for potential issues,false
VPNs not connecting on all remote sites. Users getting error message 'Connection timed out'. High percentage of users affected.,complex,networking,high,frustrated,Verify VPN server and routing configurations.,false
Our company's main website (example.com) is intermittently unavailable. We get error 'DNS lookup failed'. All departments affected.,complex,networking,critical,urgent,Check DNS server logs and recursive queries for errors.,false
"WIFI is dropping connections randomly. We have a lot of devices (smartphones, laptops) connecting simultaneously. Can you help troubleshoot?",complex,networking,high,calm,Inspect wifi router logs and wireless configuration settings.,false
My laptop's keyboard is stuck and won't register any key presses. Can you please help?,simple,hardware,low,calm,Restart the laptop and try again,true
"Ugh, my printer is jammed AGAIN! The paper got stuck and now it won't print anything.",simple,hardware,medium,frustrated,Check for and clear any stuck paper,true
I'm trying to use my new monitor but it's not turning on. Can someone please help me troubleshoot?,simple,hardware,low,urgent,Check the power cord and outlet first,true
My laptop keyboard is not working properly. The 'e' and 'a' keys don't register anymore.,simple,hardware,low,frustrated,Check USB connections and restart computer,true
Printer won't turn on. Just got it yesterday...please help!,simple,hardware,low,urgent,Check power cord and outlet,true
I'm trying to troubleshoot this monitor issue. Screen is flickering and won't stabilize.,simple,hardware,medium,calm,Check cable connections and try restarting computer,true
"my mouse is not working properly, the cursor jumps all over the screen",simple,hardware,low,frustrated,Try a different USB port or restart computer,true
Printer won't turn on. I pressed all the buttons and nothing happened.,simple,hardware,low,calm,"Check power cord and outlet, try a different wall socket",true
My keyboard is sticky! F and J keys are the worst offenders... Ugh!,simple,hardware,medium,frustrated,"Clean with compressed air, try restarting computer",true
"My Dell laptop won't turn on. I've tried charging it, but nothing works. Can you help?",simple,hardware,low,frustrated,Power cord fault or battery issue likely.,true
I need help with my monitor's brightness. It's too dim and I can't seem to adjust it. Thanks!,simple,hardware,low,calm,Monitor settings or backlight issue.,true
I'm going crazy with my printer! It just stopped working after a few pages. Help please?!,simple,hardware,medium,panicked,Paper jam or incorrect settings likely.,true
My laptop keyboard is not working. Some keys don't register when I type. Can you please help me troubleshoot?,simple,hardware,low,calm,Try restarting the laptop or checking for dust buildup.,true
"Ugh, my monitor is not turning on. I tried plugging it into a different outlet and it still doesn't work! Help!",simple,hardware,low,frustrated,Check the power cord and ensure it's securely plugged in.,true
"I just got a new printer and when I try to print, it keeps saying 'paper jam'. But there is no paper stuck! What's going on?",simple,hardware,medium,confused,Try resetting the printer or checking for a stuck tray.,true
My laptop's touchpad stopped working suddenly. I've tried restarting it.,simple,hardware,low,frustrated,try disabling and re-enabling the touchpad settings,true
"Printer won't turn on. Just got it yesterday, super disappointed.",simple,hardware,medium,urgent,try plugging into a different outlet or resetting the printer,true
Keyboard keys are sticky. Think it might be due to my cat hair accumulation?,simple,hardware,low,calm,try cleaning with compressed air and a soft cloth,true
"My Dell Inspiron won't turn on, please help. I tried charging it for hours.",simple,hardware,low,frustrated,Check power cord and battery level,true
Printer not printing in color. Is it a toner issue or something else?,simple,hardware,medium,calm,Try resetting printer settings,true
Mouse is completely dead. Need a new one ASAP! Hurry!,simple,hardware,low,urgent,Replace mouse with spare or order new one,true
My laptop's keyboard is malfunctioning. The keys are sticky and won't register properly.,simple,hardware,low,frustrated,Clean the keyboard with compressed air and a soft cloth,true
"Printer won't turn on. I tried unplugging it and plugging it back in, but nothing.",simple,hardware,medium,calm,Check the power cord and plug; also try resetting the printer,true
Urgent! My monitor won't display anything! I just got a new laptop and it's not recognizing it.,simple,hardware,medium,urgent,Check the video cable connection; try restarting the monitor,true
My keyboard is not working properly. The 'a' and 's' keys are stuck.,simple,hardware,low,frustrated,Try cleaning the keyboard's crevices,true
I need help with my printer. It keeps jamming and won't print more than one page at a time.,simple,hardware,medium,calm,Try resetting the printer's default settings,true
HELP! My laptop screen is frozen and won't turn back on!,simple,hardware,low,panicked,Try pressing the power button for 30 seconds to reset,true
My keyboard won't turn on. I just bought it yesterday and the battery level is supposed to be high.,simple,hardware,low,frustrated,Try replacing batteries or check for obstruction.,true
"Hello, my monitor is not displaying any images. I've tried unplugging and replugging it, but nothing's working!",simple,hardware,medium,urgent,Check the display settings or video cable.,true
"Hey, I'm having trouble connecting my USB stick to my desktop. It's not recognizing it at all.",simple,hardware,low,calm,Try plugging it into a different port or reformatting the stick.,true
"My Dell laptop is freezing and won't turn off properly. Sometimes it restarts itself. I've tried restarting several times, but the issue persists.",moderate,hardware,medium,frustrated,Check for loose connections and dust accumulation,true
"Printer not printing documents. Says paper jam, but there's no jam. Tried cleaning the rollers, still doesn't work.",moderate,hardware,high,calm,Check printer settings and ensure correct paper alignment,true
"Urgent help needed! My keyboard is not working. I've tried unplugging and replugging, still doesn't work. I have a deadline to meet!",moderate,hardware,high,panicked,Try swapping keyboards or restarting computer,true
My laptop is freezing up every hour or so. Sometimes I get a blue screen of death. Other times it just freezes and I have to hard reset.,moderate,hardware,medium,frustrated,Check for overheating or loose connections,true
Printer won't turn on. Tried unplugging and replugging but nothing's working.,moderate,hardware,high,urgent,Check power cord and printer settings,true
Keyboard is super slow and unresponsive. Sometimes letters don't register at all.,moderate,hardware,medium,calm,Try restarting or updating drivers,true
My laptop won't turn on. I got the battery replaced yesterday and now it's dead again.,moderate,hardware,high,frustrated,Check power source and battery health,true
"The monitor on my desk is displaying a weird blue screen. Sometimes it shows my desktop, sometimes just static.",moderate,hardware,medium,calm,Try adjusting display settings or check for loose cables,true
HELP! My keyboard stopped working and now my mouse is lagging too. I've tried restarting but nothing's working.,moderate,hardware,medium,panicked,Check for loose connections or try booting in safe mode,true
My keyboard won't type letters only symbols when I'm using Microsoft Word. This started happening yesterday.,moderate,hardware,medium,frustrated,Check keyboard settings and update drivers if necessary,true
"I have two monitors, but the second one is not displaying anything. The first monitor works fine.",moderate,hardware,high,calm,Check video cable and port connections,true
Urgent! My laptop won't turn on after the battery died. It was plugged in and charging when it just shut down.,moderate,hardware,high,urgent,Try charging for an hour and then try booting up again,true
My laptop's keyboard is stuck and some keys don't register. Can someone please fix this?,moderate,hardware,medium,frustrated,check sticky key caps and clean keyboard,true
One of our office monitors is displaying a weird vertical line. Is it just me or is this a thing?,moderate,hardware,high,calm,check video cable and monitor settings,true
HELP! Printer won't turn on and it's causing major delays for my team. What do I do?!,moderate,hardware,high,panicked,check power cord and printer settings,true
"My laptop won't turn on. I tried charging it and booting in safe mode, but nothing's working.",moderate,hardware,medium,frustrated,Verify power cord and try a different outlet,true
I'm having trouble with my keyboard - the 'e' key is stuck. It's been doing it all day.,moderate,hardware,high,calm,Try cleaning the key and checking for debris under the keyboard,true
"URGENT: Printer not printing. I've checked the ink levels and everything looks fine, but NOTHING'S WORKING!!!",moderate,hardware,high,panicked,Verify printer cable and try a different USB port,true
My laptop screen is flickering and sometimes turns black. It happened after I installed a new app yesterday.,moderate,hardware,medium,calm,Try uninstalling the new app to see if it resolves the issue,true
Why do I have to deal with this stupid printer every day?! It keeps jamming and won't print properly!,moderate,hardware,high,frustrated,Check the toner levels and make sure the paper tray is properly aligned,true
"My monitor is not showing any image when I plug in my USB. It was working fine yesterday, but now it just doesn't turn on.",moderate,hardware,medium,urgent,Try plugging the USB into a different port or computer to isolate the issue,true
"My keyboard stopped working suddenly. Nothing changed on my end, but when I plug it into another computer, it works fine.",moderate,hardware,medium,calm,Try swapping USB ports or updating keyboard drivers,true
"Freaking printers are driving me crazy! Every time I try to print a doc, it says 'out of paper' even when there's tons left!",moderate,hardware,high,frustrated,Check printer's physical paper tray for blockages or jammed pages,true
"I'm having trouble with my laptop's monitor. Sometimes it shows the desktop, other times it's just a black screen. Nothing in settings seems to work.",moderate,hardware,medium,urgent,Try restarting laptop or adjusting display settings for compatibility,true
My laptop won't turn on. It just stopped working after I accidentally spilled coffee on it.,moderate,hardware,high,frustrated,Check for liquid damage and possible short circuit,true
Printer not printing. Got an error message saying paper out when it's clearly in.,moderate,hardware,medium,calm,Reset the printer and check paper jam,true
Urgent! My monitor is flickering like crazy. Can't even see what's on the screen!,moderate,hardware,high,urgent,Check for loose connections and possible hardware failure,true
My laptop screen is flickering and the keyboard is slow. Tried restarting but it didn't help.,moderate,hardware,medium,frustrated,Check disk space and event logs,true
"Printer is not printing in color, only black. Already replaced the ink cartridge.",moderate,hardware,high,calm,Verify print settings and paper alignment,true
"Suddenly my mouse won't scroll, it's super annoying. This is the second time this week.",moderate,hardware,medium,panicked,Check USB connections and device manager,true
"Printer won't turn on, and I really need to print this report for my manager. Urgent help needed.",complex,hardware,critical,urgent,Check power cord and ensure it's plugged in correctly.,true
"Multiple monitors on my desktop are malfunctioning - freezing, flickering, or completely black. Frustrating!",complex,hardware,high,frustrated,Try restarting the graphics card driver and updating video settings.,true
I'm experiencing intermittent keyboard issues - sometimes keys won't register. Can someone please investigate?,complex,hardware,high,calm,Check for dust accumulation and clean the keyboard if necessary.,true
Printers not working on entire floor. Tried restarting printer and still nothing. Can't print reports for manager.,complex,hardware,high,frustrated,Verify network connection and port settings,true
Keyboard on sales floor is acting wonky. Typing random characters. Need assistance to fix or replace ASAP.,complex,hardware,critical,urgent,Check for dust buildup and firmware updates,true
"Multiple laptops in creative department having issues with USB drives not detected. Tried updating drivers, no luck.",complex,hardware,high,calm,Check for USB port conflicts and device manager settings,true
"Printer won't turn on. I've tried unplugging it, waiting a minute, and plugging it back in. Still nothing.",complex,hardware,critical,frustrated,Check power cord and outlet,true
"Keyboard issue: keys repeat randomly. Happens on both desktops in our office, so it's not just one system.",complex,hardware,high,calm,Firmware update may resolve issue,true
MUST FIX NOW! Our entire team's laptops are having issues. Can't connect to VPN or access files on the server!,complex,hardware,critical,panicked,Check network cables and settings,true
My Dell XPS 15 won't turn on after upgrading to Windows 11. It was working fine earlier today.,complex,hardware,high,frustrated,Check BIOS settings and boot order,true
Printer is not printing in duplex mode despite setting it in printer preferences. Can anyone help me with this?,complex,hardware,critical,calm,Check printer settings and firmware updates,true
**EMERGENCY** Our entire office's monitors are flickering and turning off randomly! This is a major issue!,complex,hardware,critical,panicked,Check power supplies and video cables,true
Printer not recognized by multiple PCs on the network. Error message says 'unknown device'.,complex,hardware,high,frustrated,Check printer settings and IP address on all affected systems.,true
Several users complaining of keyboard lag and slow typing. Issue seems to affect only certain models of keyboards.,complex,hardware,critical,urgent,"Investigate potential driver or firmware issue, update if necessary.",true
Display issue with one of our main monitors - the brightness and contrast controls aren't working like they should. Multiple people are affected.,complex,hardware,high,calm,"Check monitor settings, try adjusting or replacing display settings file.",true
"My desktop's keyboard is not functioning properly. I've tried unplugging and replugging it, but the issue persists. Please assist.",complex,hardware,high,frustrated,Check for stuck or damaged keys,true
Urgent help needed! Our company's main printer is jammed and refuses to print. Multiple users are affected.,complex,hardware,critical,urgent,Check paper tray alignment and clear any jams,true
"I've got a user whose laptop screen is displaying strange artifacts (lines, blurs) and it's causing them to lose work. Can you please assist in resolving this?",complex,hardware,high,calm,Check for loose connections or faulty graphics drivers,true
"Printer not recognizing USB flash drives. Tried updating drivers, still doesn't work. Can we get a senior engineer to help? Thanks!",complex,hardware,high,frustrated,Check printer firmware and USB ports.,true
We're experiencing slow performance on all desktops in the marketing department. It's affecting our production schedule. Please assist ASAP!,complex,hardware,critical,urgent,Check disk space and event logs for bottlenecks.,true
"I'm having trouble getting my new laptop to connect to the office Wi-Fi. Tried restarting router and modem, no luck. Can someone please help me get online?",complex,hardware,high,calm,Verify wireless settings and network configuration.,true
"Laptop won't turn on after update; tried charging, restarting. Multiple users affected.",complex,hardware,critical,frustrated,Check power settings and bios settings.,true
"Printer won't print from multiple devices. Tried resetting, unplugging/replugging.",complex,hardware,high,calm,Check printer settings and network connectivity.,true
Multiple keyboards not functioning after installing new software; urgent help needed!,complex,hardware,urgent,panicked,Roll back software update and check keyboard drivers.,true
"Printer not recognized on new laptop. Tried uninstalling and reinstalling, still nothing. Please help.",complex,hardware,high,frustrated,Check USB ports for interference or corrupt drivers,true
"Multiple users complaining of slow desktop performance. Already tried disk cleanup and updates, still slow. Need expert help ASAP.",complex,hardware,critical,urgent,Check CPU usage and potential resource bottlenecks,true
"Confused about why monitor not working with new laptop. Thought it was a HDMI issue, but nope. Frustrated now.",complex,hardware,high,confused,Check video settings and confirm display compatibility,true
"Laptop freezing on startup after software update. Tried restarting, no luck. Multiple users affected.",complex,hardware,high,frustrated,Check system logs for errors and uninstall recent updates to test.,true
Our printer's not printing in color. All black text only. Users are upset about the meeting materials.,complex,hardware,critical,urgent,Check ink levels and paper alignment; try reinstalling printer drivers if needed.,true
Two keyboards not responding on one desk. Users are confused why their typing isn't registering.,complex,hardware,high,confused,Check USB ports for debris and swap out keyboards to isolate the issue.,true
Can't open Microsoft Word. Error message says file is corrupted. Tried restarting computer.,simple,software,low,frustrated,Check for disk space and try reinstalling Office,false
Just installed new WordPress theme and it's not showing up on my website. Help!,simple,software,medium,calm,Check the theme settings and try re-saving the page,false
Adobe Photoshop keeps crashing when I'm trying to edit a photo. This is getting ridiculous!,simple,software,low,panicked,Try closing other resource-heavy programs and restarting PS,false
"I'm trying to install the new version of Excel, but it says my license is invalid. Can you help me activate it?",simple,software,low,frustrated,Check your account for the latest license key and try installing again.,false
I'm experiencing some weird crashes when trying to play this new video game. Anyone know what's going on?,simple,software,medium,calm,Try updating the graphics drivers and see if that fixes the issue.,false
"Ugh, Adobe Reader is freezing all the time! Can you please just reset it or something?",simple,software,low,frustrated,Try restarting your computer and see if that resolves the issue.,false
"Error message pops up when I try to open Microsoft Office: ""Word has stopped working""",simple,software,low,frustrated,Update Word to latest version,false
"I'm trying to download Adobe Photoshop, but the website won't let me login. I keep getting a password error.",simple,software,medium,calm,Check Adobe account credentials and try clearing browser cache,false
"My PC is stuck on Windows Update loop! It's been going for hours, I've tried restarting but nothing works!",simple,software,low,panicked,Pause and retry Windows Update or seek admin help,false
"I'm trying to install Skype on my laptop, but it keeps failing. Can you help?",simple,software,low,calm,Try restarting the installer.,false
HELP! Windows Update is stuck and my computer's been rebooting nonstop!,simple,software,medium,frustrated,Try canceling the update and restarting.,false
I just got a new graphics tablet and Adobe Illustrator keeps crashing on me. Any ideas?,simple,software,low,confused,Try updating your drivers or reinstalling the app.,false
I'm trying to install Adobe Photoshop and keep getting an error message saying it's not compatible with my Windows 10. Can you please help me figure out what's going on?,simple,software,low,calm,Try installing Photoshop in compatibility mode.,false
"Ugh, Microsoft Office is crashing every time I try to open Word! Can you please fix this ASAP? I have a huge report due tomorrow.",simple,software,medium,frustrated,Try reinstalling Microsoft Office or updating it to the latest version.,false
"Hi, I'm having trouble updating my browser. It keeps saying it's up-to-date when it's clearly not. Can you help me get the latest version?",simple,software,low,calm,Check your internet connection and try updating the browser again.,false
"When I open Word, it freezes and I have to force quit. This happened with last week's update. Can you help?",simple,software,low,frustrated,Try updating Office suite,false
"I'm trying to install Chrome, but it says 'another instance is running'. I already closed all my tabs! Can someone help?",simple,software,medium,calm,Check if Chrome is still running in background,false
"I just got a new laptop and Adobe Photoshop won't open! I tried reinstalling, but no luck. HELP!",simple,software,medium,panicked,Check license status or reinstall in safe mode,false
"Hi, my laptop won't boot up after installing the new Windows update. It just shows a blank screen with a spinning wheel.",simple,software,low,calm,Try safe mode or system restore.,false
"I'm trying to get the new graphics drivers installed for my work laptop, but it keeps failing with an 'unknown error'. HELP!",simple,software,medium,frustrated,Check software updates and try again.,false
"My favorite video editing app keeps crashing whenever I try to export a project. It worked fine yesterday, what's going on?",simple,software,medium,confused,Check for updates and try restarting the app.,false
I'm trying to install Chrome on my work laptop but it won't let me due to a 'corrupted installation',simple,software,low,frustrated,Try reinstalling Chrome with admin privileges,false
My Office app is crashing every time I try to open a document. It was working fine yesterday,simple,software,medium,calm,Check for any recent updates and try restarting the app,false
I'm getting an error message saying my Outlook is not licensed when it totally is... what's going on?!,simple,software,low,panicked,Try restarting the Outlook app and see if that resolves the issue,false
"I'm trying to install Office 2016 on my work laptop, but it keeps failing. Can you help?",simple,software,low,frustrated,Reinstall Office and try again.,false
"I just updated my Acrobat software, but now the PDF viewer is acting really wonky. Can you troubleshoot this?",simple,software,medium,calm,Try reinstalling Acrobat and see if that fixes it.,false
"WOW, I just got a Blue Screen of Death on my work PC and Office 365 is frozen. Can someone PLEASE fix this ASAP?!",simple,software,high,urgent,Restart your computer and try running Windows Update.,false
"I'm trying to install Java on my Windows laptop, but it keeps crashing. Please help!",simple,software,low,frustrated,Reinstall Java with administrator privileges.,false
"I'm having trouble uninstalling Adobe Reader on my Mac. It won't quit! Calm help, please.",simple,software,medium,calm,Force quit the process using Activity Monitor.,false
I accidentally uninstalled Microsoft Office on my work computer. Can you please restore it? It's an emergency!,simple,software,low,urgent,Restore from backup or reinstall with license key.,false
Microsoft Office is slow and unresponsive on all computers. Users are frustrated.,moderate,software,medium,frustrated,Check for updates and restart the application.,false
I'm getting a blue screen on my work laptop after installing Visual Studio. Help!,moderate,software,high,urgent,Try safe boot and remove recent drivers.,false
Outlook keeps crashing every hour or so. Users are getting annoyed.,moderate,software,medium,calm,Run the built-in troubleshooter and check for updates.,false
"Computer is freezing and not responding to mouse clicks. Tried restarting, no change.",moderate,software,medium,frustrated,Check for driver updates and test.,false
