text,complexity,domain,severity,tone,resolution_hint,requires_onsite
I'm trying to install a new app but it says my OS is outdated. I just got this laptop and it's really annoying.,simple,software,medium,calm,Update your operating system to the latest version.,false
"HELP! Microsoft Word won't open and I have a deadline in an hour! This is ridiculous, it worked fine yesterday!",simple,software,low,panicked,Try reinstalling the MS Office suite.,false
Error message pops up when I start my laptop. It says my Outlook doesn't recognize the latest update.,simple,software,low,frustrated,Check for updates and reboot.,false
"I'm trying to install a new software, but it says I need permission from an administrator. Can you help?",simple,software,medium,calm,Run the installer as an admin.,false
Why does my PC keep freezing every hour?! It's so annoying! Please fix this ASAP!,simple,software,low,urgent,Check for disk errors and update drivers.,false
"I'm trying to install Adobe Reader on my work laptop, but it says 'file not found'.",simple,software,low,calm,Check download folder for corrupted file.,false
"The Microsoft Word shortcut keeps jumping around on my desktop, drives me crazy!!!",simple,software,medium,frustrated,Reset default program settings.,false
I'm getting an error message when trying to update Firefox on my home computer. It says something about a 'missing extension'.,simple,software,low,urgent,Check browser extensions for updates.,false
My Word document is frozen and won't move from the loading screen. Help!,simple,software,low,frustrated,Try closing and reopening the app.,false
"I'm trying to install a plugin for my Adobe Creative Cloud, but it's not showing up in the menu. Any ideas?",simple,software,medium,calm,Check if you installed it correctly or contact Adobe support.,false
I just got my new laptop and the login screen is stuck on 'Welcome to Windows'! Can you please help me?,simple,software,low,urgent,Try pressing Ctrl+Alt+F1 or F2 for a console login.,false
"I'm trying to install Adobe Photoshop, but it keeps crashing on my laptop. Can you help me?",simple,software,low,frustrated,Try reinstalling the app and updating graphics drivers.,false
"Hey, my Microsoft Office icons are all messed up! I'm using Windows 10, is this a known issue?",simple,software,medium,calm,Try reinstalling the Office suite or checking for updates.,false
"Ugh, my VLC media player won't play my MP3 files! I've tried restarting and updating, but nothing works. HELP!!",simple,software,low,panicked,Try reinstalling VLC or resetting its settings.,false
I'm trying to update Adobe Reader but it's stuck on the installation screen. Please help!,simple,software,low,frustrated,Try restarting the installer.,false
I accidentally updated my Microsoft Office suite and now it's causing issues with formatting. Can you fix?,simple,software,medium,calm,Try reverting the update and see if that resolves the issue.,false
HELP! My computer won't start because of some stupid Java error message. What do I do?!!,simple,software,low,panicked,Try uninstalling and re-installing the Java runtime.,false
I'm having trouble installing Adobe Reader on my work laptop. It says it's already installed but I know I didn't install it.,simple,software,low,frustrated,Reinstall Reader or check if another app is using the same installation directory.,false
Microsoft Word keeps crashing whenever I try to save my document. It's really frustrating!,simple,software,medium,urgent,Try closing unnecessary apps or restarting your computer to resolve the issue.,false
I've been trying to update my browser but it keeps failing. It's saying something about a missing dll file?,simple,software,low,confused,Check the browser's log files for more information and try updating again.,false
Microsoft Office not opening. I've tried restarting and it still doesn't work. Please help.,simple,software,low,calm,Try updating Microsoft Office to the latest version.,false
"Ugh, my Adobe Photoshop plugin just crashed AGAIN. Can you fix this? It's really annoying!",simple,software,medium,frustrated,Try reinstalling the Adobe Photoshop plugin or updating to the latest version.,false
I accidentally installed an older version of Java and now my Android Studio isn't working. Help me reverse this!,simple,software,low,calm,Uninstall the older Java version and install the latest one.,false
My Microsoft Office app keeps crashing when I try to open a document. Any ideas? Thanks!,simple,software,low,calm,try restarting the app,false
I can't believe my Adobe Photoshop just froze on me AGAIN! Please help! I have a deadline and I'm stuck.,simple,software,medium,frustrated,try closing other resource-intensive apps,false
"Hi, my Microsoft Teams won't let me log in. Error message says 'invalid username'. I'm sure it's just a simple password typo, right?",simple,software,low,calm,check your password and try re-logging in,false
"I'm trying to connect to my PostgreSQL database, but it's taking forever. Any idea why the connection is timing out?",simple,database,low,frustrated,Check timeout settings and adjust as needed.,false
"Hey, I'm having trouble querying my MySQL database. It seems like it's not recognizing the table even though it exists.",simple,database,medium,calm,Verify schema and table names for correct capitalization.,false
"Ugh, I'm getting a 'connection refused' error when trying to connect to my MongoDB instance. What's going on?!?",simple,database,low,panicked,Ensure the service is running and firewall rules are not blocking the connection.,false
Having trouble connecting to MySQL database. Getting 'Error 1045' message.,simple,database,medium,frustrated,Verify password and try reconnecting,false
Why can't I execute my query? Error message says 'no such table'. It's definitely there!,simple,database,low,confused,Check table name case and quotes if using,false
MongoDB issue: timed out after 30 seconds. My app is stuck.,simple,database,urgent,panicked,Increase connection timeout or use async queries,false
"I'm trying to connect to my local Postgres instance, but it's not recognizing my username/password. I've tried restarting the service and checking the files, but no luck.",simple,database,medium,frustrated,Check config file for typo or incorrect path,false
"Hi, I'm having trouble with my MySQL connection pooling. Sometimes it takes a few seconds to reconnect after a timeout. Can you help me optimize the settings?",simple,database,low,calm,Adjust max_connections and wait_timeout values,false
"Ugh, I've been getting random errors trying to query my MongoDB collection. It's like it's timing out or something! Please help me troubleshoot this ASAP.",simple,database,medium,urgent,Check replica set status and adjust timeout values if necessary,false
"Hi, I'm getting an error when trying to connect to my PostgreSQL database. It says 'server closed the connection unexpectedly'.",simple,database,low,calm,Check connection string and timeout settings.,false
"Ugh, I'm trying to query my MySQL database but it's timing out after 5 seconds. This is the fifth time this week! Help!",simple,database,medium,frustrated,Increase timeout value or optimize query performance.,false
I'm trying to connect to my MongoDB instance but I keep getting a 'connection refused' error. Any ideas?,simple,database,low,confused,Check if the server is running and check firewall rules.,false
"I'm trying to connect to my PostgreSQL database, but I get an error saying it's not listening. Can you please help me troubleshoot this?",simple,database,low,calm,Check the database service status and restart if necessary.,false
MySQL connection pool is not working! I'm getting timeouts all over the place. Please fix this ASAP!,simple,database,medium,frustrated,Verify connection pool settings and adjust timeout values.,false
"I'm trying to query my MongoDB collection, but it's taking forever. Can you tell me why my queries are so slow?",simple,database,low,confused,Check index usage and optimize your query syntax.,false
"I'm trying to connect to our MySQL database from my local machine, but it keeps timing out. Any ideas?",simple,database,medium,frustrated,Check network settings and firewall rules,false
"Hi, I'm having trouble with a PostgreSQL query. It's taking forever to run even with indices applied. Can you help?",simple,database,low,calm,Verify query syntax and index usage,false
"Ugh, MongoDB is driving me crazy! I'm trying to connect using the compass app, but it just won't authenticate. Please help!",simple,database,medium,panicked,Double-check credentials and network settings,false
I'm trying to connect to my database but it's timing out. Any ideas why?,simple,database,medium,frustrated,Check connection string and timeout settings.,false
"Can't seem to get a query running in PostgreSQL. Syntax error, I think? Help!",simple,database,low,calm,Double-check SQL syntax and query structure.,false
"MongoDB connection pool not working! Any suggestions or a hint would be awesome, thanks!",simple,database,medium,urgent,Check MongoDB config and verify connection details.,false
Error while querying database: SELECT statement timed out. Can't retrieve data.,simple,database,low,frustrated,Check timeout settings and query optimization.,false
I'm trying to connect to a PostgreSQL database but it's throwing an error saying 'connection refused'. Can you help?,simple,database,medium,calm,Verify connection details and check for blocking rules.,false
MONGO DB CONNECTION IS BROKEN!!! I just tried to insert data and it gave me an error saying the collection doesn't exist!,simple,database,low,panicked,Check MongoDB cluster status and ensure correct database selection.,false
Error connecting to MySQL database: 'Can't connect to MySQL server on localhost (4)'. Tried restarting and verifying credentials.,simple,database,low,frustrated,Check firewall settings and ensure correct port number,false
"Need help with PostgreSQL query. Trying to count unique values in a column, but getting unexpected results.",simple,database,medium,calm,Verify query syntax and column data type,false
MongoDB connection pooling not working. Users are getting errors: 'Connection to database closed'. It's been down for hours!!,simple,database,low,panicked,Check pool size and idle timeout settings,false
PostgreSQL connection pool timeout issue. Unable to execute query. Please resolve ASAP.,simple,database,medium,urgent,Check pool settings and adjust timeouts if needed,false
I'm trying to connect to my MongoDB database but I keep getting an error saying it's not available. Can you please help me figure out what's going on?,simple,database,low,frustrated,Check connection string and database status,false
I'm getting an error with my SQL query. It says 'unknown column' even though I'm sure the column exists. Can you help me troubleshoot this?,simple,database,medium,calm,Check query syntax and table schema for errors,false
"I'm trying to install new plugin for project management tool, but it keeps crashing with error message. Can someone help me troubleshoot?",moderate,software,medium,frustrated,Check plugin compatibility with current software version.,false
"Hey, my computer is freezing randomly after updating to new Windows build. Could you assist me in resolving this?",moderate,software,high,urgent,Check for conflicts with newly installed software or drivers.,false
"I'm having trouble launching Microsoft Office application on my laptop. It keeps prompting for a license key, even though I've already activated it. Any ideas?",moderate,software,medium,calm,Verify licensing information and ensure correct product key entry.,false
My Microsoft Office suite keeps crashing on startup. Error message says 'invalid file type'. This is affecting 3 users. Please help.,moderate,software,medium,frustrated,Try reinstalling Office or updating to latest version.,false
Hello! I'm trying to install Adobe Acrobat Reader but it keeps asking for a serial number even though I have the correct one. This is urgent!,moderate,software,high,urgent,Check if there's an update available or try installing it again.,false
"Hey, I'm having some issues with Microsoft Teams. Sometimes my messages don't send and other times they do. This is kinda confusing.",moderate,software,medium,confused,Check for updates or try restarting the app.,false
"I'm trying to install Office, but the download keeps failing. It says I need to update my .NET framework, but it won't let me do that either.",moderate,software,high,frustrated,Check for any active .NET updates and try the install again.,false
"When I open Excel, it takes forever to load. The other apps seem fine. Any idea why this might be happening?",moderate,software,medium,calm,Check for any corrupted add-ins or settings and try a profile reset.,false
My laptop won't turn on! I was just in the middle of an important project and now my machine is dead. Please help!,moderate,software,high,panicked,Try booting in safe mode to troubleshoot any hardware issues.,false
"Computer won't turn on after windows update. I've tried restarting, but nothing happens. Please help!",moderate,software,high,frustrated,Check system logs and restore previous Windows version if necessary.,false
"Error message keeps popping up saying 'Outlook not responding'. I've tried closing the app, but it persists. Can you troubleshoot?",moderate,software,medium,calm,Restart Outlook or check for any plugin conflicts.,false
"Adobe Flash player keeps crashing on my laptop. I've tried uninstalling and reinstalling, but the problem persists. Help!?!",moderate,software,high,panicked,Try updating Adobe Flash player or check for any malware.,false
My Word document won't open. It just crashes every time I try to edit it.,moderate,software,medium,frustrated,Check for corrupted file and try saving as a different format,false
I'm having trouble updating my Chrome browser. The download keeps failing.,moderate,software,medium,calm,Try re-downloading the update and disable any extensions causing issues,false
"Urgent! My Excel file keeps opening read-only mode, even though I've saved it multiple times!",moderate,software,high,urgent,Check file permissions and ensure you're saving in the correct location,false
Issue with Excel spreadsheet formatting after recent update. Data not displaying correctly.,moderate,software,medium,frustrated,Check for formatting plugin issues and update if necessary.,false
Can't launch new instance of Word after installing newest Office suite. Error message says 'unknown error'.,moderate,software,high,panicked,"Run the built-in troubleshooter and if issues persist, try reinstalling the application.",false
Chrome browser keeps crashing when I try to access certain websites. Tried restarting but no luck.,moderate,software,medium,calm,Try disabling any recently installed extensions and see if the issue persists.,false
"I'm trying to install the latest accounting software, but it says my license is invalid. I've checked everything and can't find the issue.",moderate,software,high,frustrated,Verify license details in account settings,false
The new HR module on our company's software is not saving changes. Can you help me figure out why? It was working fine yesterday.,moderate,software,medium,calm,Check for concurrent user issues or plugin conflicts,false
"Ugh, this is the third time today our sales tracking software has crashed on me! Can you please look into it? It's really affecting my workflow.",moderate,software,high,urgent,Check system logs for error patterns and potential plugin conflicts,false
My Chrome browser is freezing frequently and not responding. I've tried closing and reopening multiple times. It's really frustrating.,moderate,software,high,frustrated,Check extensions and update browser version,false
"I'm trying to install a new software but it keeps prompting for a serial number. I know I entered it correctly, can you help?",moderate,software,medium,calm,Verify serial number format and contact vendor if needed,false
"I'm having trouble opening Word documents on my laptop. They just won't open! I've tried different apps, rebooted, nothing works.",moderate,software,high,panicked,Check file associations and reinstall Microsoft Office if necessary,false
"I'm trying to install MS Office on my laptop, but it keeps failing with an error message saying 'invalid product key'.",moderate,software,medium,frustrated,Verify product key and check for any typos.,false
"I just got a new HP laptop and I'm trying to install Google Chrome, but it won't work. The error message says 'plugin failed'.",moderate,software,high,calm,Check for incompatible plugins or browser versions.,false
I'm getting a blue screen of death every time I try to open Adobe Photoshop! It's driving me crazy!!!,moderate,software,high,panicked,Try safe mode or system restore to troubleshoot the issue.,false
"My Adobe Acrobat app keeps crashing on startup. Tried reinstalling, no luck.",moderate,software,medium,frustrated,Check for updates and try repairing installation.,false
Having trouble installing new plugins on Excel. Getting error 'Plugin not found'.,moderate,software,high,calm,Verify plugin compatibility and try reinstalling.,false
Can't believe my browser keeps freezing after I updated to Chrome 92. So annoying!,moderate,software,medium,frustrated,Roll back to previous version or update browser extensions.,false
Database connection pool issue: queries timing out and not completing. Users reporting errors when trying to access data.,moderate,database,high,frustrated,Check pool settings and query queueing,false
Having issues with a MySQL query that's not returning expected results. Can you help me optimize it or provide an alternative?,moderate,database,medium,calm,Examine index usage and join order,false
MongoDB not replicating data across nodes. Users are seeing inconsistent data. Please help resolve this ASAP.,moderate,database,high,urgent,Verify replica set configuration and network connectivity,false
Error message saying connection timed out when trying to query MongoDB. Happens every hour. Need help figuring out why this is happening.,moderate,database,high,frustrated,Check network latency and connection settings,false
We're getting a lot of slow queries on our MySQL database. Users are reporting long load times. Can you help us optimize the database?,moderate,database,medium,calm,Index columns and adjust query parameters,false
PostgreSQL database randomly crashing every night. Users can't access data during this time. Please help us troubleshoot!,moderate,database,high,urgent,Check log files for error patterns and restart database processes,false
"I'm trying to query our database, but it's taking forever to return results. Sometimes it just hangs.",moderate,database,medium,frustrated,Check query timeout settings.,false
Error message says connection pool is exhausted. How do I clear it? It's impacting our sales report.,moderate,database,high,urgent,Restart the application server.,false
Mongodb query returning incorrect data. Users are seeing mixed results for their orders. Help!,moderate,database,medium,panicked,Verify MongoDB schema integrity.,false
"Hi, I'm experiencing issues connecting to our MySQL database. Error message says 'connection timed out' every time I try to run a query.",moderate,database,medium,frustrated,Check connection pool settings and timeout values,false
"Hey, I'm getting a weird error message when trying to run a SQL query in our MongoDB Atlas instance: 'invalid operation on non-existent collection'. Any ideas?",moderate,database,high,calm,Verify collection exists and data type matches expectations,false
"Ugh, I've been trying to run a simple query in our PostgreSQL database for the past hour, but it just keeps timing out! Any way you can help me troubleshoot this?",moderate,database,medium,panicked,Check query execution time and adjust configuration as needed,false
PostgreSQL database server is not responding. We've been getting 'timeout' errors for hours.,moderate,database,high,frustrated,Check connection pool settings and query execution plans.,false
"When I run a simple SQL query, it takes like 10 seconds to return. Why is MySQL so slow?",moderate,database,medium,calm,Look for inefficient queries or table fragmentation.,false
MONGO! Our MongoDB instance is constantly throwing exceptions. Users can't see data!,moderate,database,high,urgent,Check for corrupted data or incorrect schema definitions.,false
"Issue with my PostgreSQL database: when I try to query, it takes over 30 seconds to complete. This is causing delay in our daily reports.",moderate,database,high,frustrated,Check query timeout settings and adjust as needed,false
Having trouble connecting to our MySQL instance - I keep getting an error message saying 'lost connection'. This is affecting my ability to do my job.,moderate,database,medium,calm,Try increasing the connect timeout or reducing the query load,false
"MongoDB issue! When I try to run a simple query, it times out after just a few seconds. This is causing huge delays in our data analysis workflow.",moderate,database,high,urgent,Check connection pool settings and adjust if necessary,false
"Having issues with my MySQL connection. Sometimes it takes a while to establish, and when I do get in, some queries are slow or timing out. Happens every few hours.",moderate,database,medium,frustrated,Check connection pool settings.,false
"Hi, I'm getting an error message when trying to insert data into my MongoDB collection. It says 'connection timeout' even though I know the server is running. Any ideas?",moderate,database,high,urgent,Verify cluster connectivity.,false
PostgreSQL query taking forever. I have a bunch of joins and it's using up too much CPU. Any suggestions on how to optimize this query?,moderate,database,medium,calm,Check indexing and add limits if possible.,false
"PGAdmin shows my database connection timed out, but it was working fine yesterday. Please help me troubleshoot this issue.",moderate,database,medium,calm,Check timeout settings and server logs for clues.,false
"MONGO IS DOWN AGAIN!!! I've tried restarting the service, but it's still not working. Please fix this ASAP.",moderate,database,high,frustrated,Verify MongoDB logs and cluster status for root cause.,false
We're experiencing issues with our MySQL query performance. Queries are taking ages to complete. Can you optimize the indexes or suggest another fix?,moderate,database,medium,urgent,Analyze slow queries and consider reindexing or optimizing query plans.,false
"I'm trying to query a table, but it takes over 30 seconds to return results. Sometimes it freezes and I have to restart the app.",moderate,database,medium,frustrated,Check query timeout settings,false
I'm experiencing intermittent connectivity issues with our MongoDB instance. Errors occur every few hours and impact user experience.,moderate,database,medium,calm,Monitor connection pool stats for bottlenecks,false
Urgent! Our MySQL database is crashing repeatedly throughout the day. We're experiencing significant business disruption. Please help ASAP!,moderate,database,high,urgent,Check SQL query logs for common patterns or errors,false
I'm trying to connect to my MySQL database but I keep getting timed out. Can you help?,moderate,database,medium,frustrated,check timeout settings,false
"Hello, my team and I are experiencing some weird errors with our MongoDB queries. Can you investigate?",moderate,database,high,urgent,review query logs for inconsistencies,false
"Hi, I'm having trouble getting my PostgreSQL database to connect remotely. The error message says 'SSL connection required'. Help?",moderate,database,medium,calm,enable SSL encryption for remote connections,false
Software installation failed on all 12 production servers. Can't access critical app. Urgent resolution required.,complex,software,critical,urgent,Verify installation package integrity and re-run.,false
I'm getting a 'plugin not found' error on my development machine. Very frustrating!,complex,software,high,frustrated,Check plugin installation directory and try reinstalling.,false
Our company's software license has expired. Please assist with the renewal process ASAP.,complex,software,high,calm,Verify license details and initiate renewal process through vendor.,false
Our office software keeps crashing on multiple computers. Tried reinstalling and nothing works.,complex,software,critical,frustrated,Check for corrupted DLL files and attempt system restore,false
I'm getting an error message saying 'plugin not found' even though I installed it correctly. Help!,complex,software,high,urgent,Verify plugin version and compatibility with application software,false
Why does our office suite require a new license every time we update our OS? This is ridiculous. Can someone please help me?,complex,software,high,panicked,Check software licensing agreement and confirm compatibility with updated OS,false
I'm experiencing a weird issue with Excel on my work laptop. It keeps crashing every time I try to open a file.,complex,software,high,frustrated,Check for updates and reinstall Excel if necessary.,false
"I have a critical issue with our company's CRM software. It's not syncing properly between all the users, causing significant delays. Can you help?",complex,software,critical,urgent,Verify database connections and ensure user permissions are correct.,false
"I'm trying to install a new plugin for Adobe Illustrator, but it's not working on my desktop. It keeps saying the file is corrupted.",complex,software,high,confused,Check the plugin's system requirements and try reinstalling if necessary.,false
